{
  "name": "variant-analysis",
  "version": "1.0.0",
  "description": "Find similar vulnerabilities and bugs across codebases using pattern-based analysis",
  "authors": [
    {
      "name": "Axel Mierczuk"
    }
  ],
  "upstream": {
    "repo": "https://github.com/trailofbits/skills.git",
    "path": "plugins/variant-analysis",
    "ref": "main",
    "type": "plugin",
    "last_synced_commit": "635e186d1dd9b4ec6ab41b4ba581c03194fe1eba",
    "last_checked": "2026-03-31T23:58:19.484552+00:00"
  },
  "source_model": "upstream-mirror",
  "canonical_harness": "claude",
  "package_type": "full-plugin",
  "files": {
    "has_skill": true,
    "has_plugin_manifest": true,
    "has_hooks": false,
    "has_commands": true,
    "has_agents": false,
    "has_templates": true
  },
  "risk": {
    "has_executable_code": false,
    "dependency_files": [],
    "tool_risk": {
      "declared_tools": [
        "Bash",
        "Glob",
        "Grep",
        "Read"
      ],
      "risk_level": "medium",
      "reasons": [
        "Bash: shell execution or file mutation"
      ]
    }
  },
  "compatibility": {
    "assessment_version": "2026-04-03.1",
    "portability_class": "adaptable",
    "supported_harnesses": [
      "claude"
    ],
    "support_basis": {
      "claude": "convention",
      "codex": "unknown"
    },
    "status_by_harness": {
      "claude": "native",
      "codex": "blocked"
    },
    "findings": [
      {
        "code": "HAS_SKILL_MD",
        "kind": "packaging",
        "severity": "info",
        "path": "skills/",
        "message": "Contains skill definitions"
      },
      {
        "code": "HAS_CLAUDE_PLUGIN_MANIFEST",
        "kind": "packaging",
        "severity": "info",
        "path": ".claude-plugin/plugin.json",
        "message": "Has Claude plugin manifest (convention)"
      },
      {
        "code": "HAS_COMMANDS_DIR",
        "kind": "packaging",
        "severity": "info",
        "path": "commands/",
        "message": "Contains slash command definitions"
      },
      {
        "code": "CLAUDE_TOOL_NAME",
        "kind": "harness",
        "severity": "info",
        "path": "(multiple)",
        "message": "References Claude tool names: Bash, Glob, Grep, Read"
      }
    ],
    "adaptation_hints": [
      "Map Claude tool names to neutral capabilities",
      "Slash commands need harness-specific packaging adaptation"
    ]
  },
  "generation": {
    "claude": {
      "enabled": true,
      "mode": "native"
    },
    "codex": {
      "enabled": false,
      "mode": "none"
    }
  },
  "verification": {
    "reviewed": false,
    "skills": {
      "variant-analysis": false
    }
  }
}
