{
  "name": "devcontainer-setup",
  "version": "0.1.0",
  "description": "Create pre-configured devcontainers with Claude Code and language-specific tooling",
  "authors": [
    {
      "name": "Alexis Challande",
      "url": "https://github.com/trailofbits"
    }
  ],
  "upstream": {
    "repo": "https://github.com/trailofbits/skills.git",
    "path": "plugins/devcontainer-setup",
    "ref": "main",
    "type": "plugin",
    "last_synced_commit": "635e186d1dd9b4ec6ab41b4ba581c03194fe1eba",
    "last_checked": "2026-04-01T00:16:10.687088+00:00"
  },
  "source_model": "upstream-mirror",
  "canonical_harness": "claude",
  "package_type": "skill-wrapper",
  "files": {
    "has_skill": true,
    "has_plugin_manifest": true,
    "has_hooks": false,
    "has_commands": false,
    "has_agents": false,
    "has_templates": true
  },
  "risk": {
    "has_executable_code": true,
    "dependency_files": [],
    "tool_risk": {
      "declared_tools": [
        "Write"
      ],
      "risk_level": "medium",
      "reasons": [
        "Write: shell execution or file mutation"
      ]
    }
  },
  "compatibility": {
    "assessment_version": "2026-04-03.2",
    "portability_class": "harness-specific",
    "supported_harnesses": [
      "claude"
    ],
    "support_basis": {
      "claude": "convention",
      "codex": "unsupported"
    },
    "status_by_harness": {
      "claude": "native",
      "codex": "unsupported"
    },
    "findings": [
      {
        "code": "HAS_SKILL_MD",
        "kind": "packaging",
        "severity": "info",
        "path": "skills/",
        "message": "Contains skill definitions"
      },
      {
        "code": "HAS_CLAUDE_PLUGIN_MANIFEST",
        "kind": "packaging",
        "severity": "info",
        "path": ".claude-plugin/plugin.json",
        "message": "Has Claude plugin manifest (convention)"
      },
      {
        "code": "CLAUDE_HOME_PATH",
        "kind": "harness",
        "severity": "error",
        "path": "skills/devcontainer-setup/resources/install.sh",
        "message": "References ~/.claude paths (2 occurrences)"
      },
      {
        "code": "CLAUDE_TOOL_NAME",
        "kind": "harness",
        "severity": "info",
        "path": "(multiple)",
        "message": "References Claude tool names: Write"
      },
      {
        "code": "EXECUTABLE_CODE_PRESENT",
        "kind": "risk",
        "severity": "warn",
        "path": "skills/devcontainer-setup/resources/install.sh, skills/devcontainer-setup/resources/post_install.py",
        "message": "Contains 2 executable file(s)"
      }
    ],
    "adaptation_hints": [
      "Map Claude tool names to neutral capabilities",
      "Replace ~/.claude path references with harness-neutral config"
    ]
  },
  "generation": {
    "claude": {
      "enabled": true,
      "mode": "native"
    },
    "codex": {
      "enabled": false,
      "mode": "none"
    }
  },
  "verification": {
    "reviewed": false,
    "skills": {
      "devcontainer-setup": false
    }
  }
}
