{
  "name": "claude-vis",
  "version": "0.1.0",
  "description": "Logs session activity, token usage, and cost to SQLite for analytics and visualization",
  "authors": [
    {
      "name": "Gabe"
    }
  ],
  "upstream": {
    "repo": "ssh://git@forgejo.bishop.landq.net:2222/Anvil/claude-vis.git",
    "path": ".",
    "ref": "main",
    "type": "plugin",
    "last_synced_commit": "d0e990d485a41fc74d68d0f9ac29c80d6a3bacbf",
    "last_checked": "2026-04-01T00:28:20.289206+00:00"
  },
  "source_model": "upstream-mirror",
  "canonical_harness": "claude",
  "package_type": "full-plugin",
  "files": {
    "has_skill": true,
    "has_plugin_manifest": true,
    "has_hooks": true,
    "has_commands": true,
    "has_agents": false,
    "has_templates": false
  },
  "risk": {
    "has_executable_code": true,
    "dependency_files": [
      "pyproject.toml"
    ],
    "tool_risk": {
      "declared_tools": [
        "Bash",
        "Read"
      ],
      "risk_level": "medium",
      "reasons": [
        "Bash: shell execution or file mutation"
      ]
    }
  },
  "compatibility": {
    "assessment_version": "2026-04-03.2",
    "portability_class": "harness-specific",
    "supported_harnesses": [
      "claude"
    ],
    "support_basis": {
      "claude": "convention",
      "codex": "unsupported",
      "copilot": "unsupported"
    },
    "status_by_harness": {
      "claude": "native",
      "codex": "unsupported",
      "copilot": "unsupported"
    },
    "findings": [
      {
        "code": "HAS_SKILL_MD",
        "kind": "packaging",
        "severity": "info",
        "path": "skills/",
        "message": "Contains skill definitions"
      },
      {
        "code": "HAS_CLAUDE_PLUGIN_MANIFEST",
        "kind": "packaging",
        "severity": "info",
        "path": ".claude-plugin/plugin.json",
        "message": "Has Claude plugin manifest (convention)"
      },
      {
        "code": "HAS_HOOKS_JSON",
        "kind": "packaging",
        "severity": "info",
        "path": "hooks/",
        "message": "Contains hook definitions"
      },
      {
        "code": "HAS_COMMANDS_DIR",
        "kind": "packaging",
        "severity": "info",
        "path": "commands/",
        "message": "Contains slash command definitions"
      },
      {
        "code": "CLAUDE_PLUGIN_CONVENTION",
        "kind": "harness",
        "severity": "warn",
        "path": "commands/stats.md",
        "message": "Uses ${CLAUDE_PLUGIN_ROOT} variable"
      },
      {
        "code": "CLAUDE_PLUGIN_CONVENTION",
        "kind": "harness",
        "severity": "warn",
        "path": "skills/stats/SKILL.md",
        "message": "Uses ${CLAUDE_PLUGIN_ROOT} variable"
      },
      {
        "code": "CLAUDE_TOOL_NAME",
        "kind": "harness",
        "severity": "info",
        "path": "(multiple)",
        "message": "References Claude tool names: Bash, Read"
      },
      {
        "code": "EXECUTABLE_CODE_PRESENT",
        "kind": "risk",
        "severity": "warn",
        "path": "scripts/__init__.py, scripts/db.py, scripts/post_tool_use.py",
        "message": "Contains 7 executable file(s)"
      },
      {
        "code": "DEPENDENCY_FILE_PRESENT",
        "kind": "risk",
        "severity": "warn",
        "path": "pyproject.toml",
        "message": "Contains dependency manifest(s)"
      }
    ],
    "adaptation_hints": [
      "Map Claude tool names to neutral capabilities",
      "Hooks require harness-specific lifecycle \u2014 consider forking for other harnesses",
      "Slash commands need harness-specific packaging adaptation"
    ]
  },
  "generation": {
    "claude": {
      "enabled": true,
      "mode": "native"
    },
    "codex": {
      "enabled": false,
      "mode": "none"
    },
    "copilot": {
      "enabled": false,
      "mode": "none"
    }
  },
  "verification": {
    "reviewed": false,
    "skills": {
      "stats": false
    }
  }
}
