{
  "name": "modern-python",
  "version": "1.5.0",
  "description": "Modern Python best practices. Use when creating new Python projects, and writing Python scripts, or migrating existing projects from legacy tools.",
  "authors": [
    {
      "name": "William Tan",
      "email": "opensource@trailofbits.com",
      "url": "https://github.com/trailofbits"
    }
  ],
  "upstream": {
    "repo": "https://github.com/trailofbits/skills.git",
    "path": "plugins/modern-python",
    "ref": "main",
    "type": "plugin",
    "last_synced_commit": "635e186d1dd9b4ec6ab41b4ba581c03194fe1eba",
    "last_checked": "2026-04-01T00:16:07.555693+00:00"
  },
  "source_model": "upstream-mirror",
  "canonical_harness": "claude",
  "package_type": "full-plugin",
  "files": {
    "has_skill": true,
    "has_plugin_manifest": true,
    "has_hooks": true,
    "has_commands": false,
    "has_agents": false,
    "has_templates": false
  },
  "risk": {
    "has_executable_code": true,
    "dependency_files": [],
    "tool_risk": {
      "declared_tools": [
        "Read"
      ],
      "risk_level": "low",
      "reasons": []
    }
  },
  "compatibility": {
    "assessment_version": "2026-04-03.2",
    "portability_class": "harness-specific",
    "supported_harnesses": [
      "claude"
    ],
    "support_basis": {
      "claude": "convention",
      "codex": "unsupported"
    },
    "status_by_harness": {
      "claude": "native",
      "codex": "unsupported"
    },
    "findings": [
      {
        "code": "HAS_SKILL_MD",
        "kind": "packaging",
        "severity": "info",
        "path": "skills/",
        "message": "Contains skill definitions"
      },
      {
        "code": "HAS_CLAUDE_PLUGIN_MANIFEST",
        "kind": "packaging",
        "severity": "info",
        "path": ".claude-plugin/plugin.json",
        "message": "Has Claude plugin manifest (convention)"
      },
      {
        "code": "HAS_HOOKS_JSON",
        "kind": "packaging",
        "severity": "info",
        "path": "hooks/",
        "message": "Contains hook definitions"
      },
      {
        "code": "CLAUDE_TOOL_NAME",
        "kind": "harness",
        "severity": "info",
        "path": "(multiple)",
        "message": "References Claude tool names: Read"
      },
      {
        "code": "EXECUTABLE_CODE_PRESENT",
        "kind": "risk",
        "severity": "warn",
        "path": "hooks/setup-shims.sh",
        "message": "Contains 1 executable file(s)"
      }
    ],
    "adaptation_hints": [
      "Map Claude tool names to neutral capabilities",
      "Hooks require harness-specific lifecycle \u2014 consider forking for other harnesses"
    ]
  },
  "generation": {
    "claude": {
      "enabled": true,
      "mode": "native"
    },
    "codex": {
      "enabled": false,
      "mode": "none"
    }
  },
  "verification": {
    "reviewed": false,
    "skills": {
      "modern-python": false
    }
  }
}
