{
  "name": "grill-me",
  "version": "0.1.0",
  "description": "Interview the user relentlessly about a plan or design until reaching shared understanding, resolving each branch of the decision tree. Use when user wants to stress-test a plan, get grilled on their design, or mentions \"grill me\".",
  "upstream": {
    "repo": "https://github.com/mattpocock/skills.git",
    "path": "grill-me",
    "ref": "main",
    "type": "raw-skill",
    "last_synced_commit": "eebfb3c99aa955d4928192fab5de247d36633502",
    "last_checked": "2026-03-31T23:58:51.017938+00:00"
  },
  "source_model": "upstream-mirror",
  "canonical_harness": "claude",
  "package_type": "skill-wrapper",
  "files": {
    "has_skill": true,
    "has_plugin_manifest": true,
    "has_hooks": false,
    "has_commands": false,
    "has_agents": false,
    "has_templates": false
  },
  "risk": {
    "has_executable_code": false,
    "dependency_files": [],
    "tool_risk": {
      "declared_tools": [],
      "risk_level": "low",
      "reasons": []
    }
  },
  "compatibility": {
    "assessment_version": "2026-04-03.1",
    "portability_class": "agnostic",
    "supported_harnesses": [
      "claude",
      "codex"
    ],
    "support_basis": {
      "claude": "convention",
      "codex": "unknown"
    },
    "status_by_harness": {
      "claude": "native",
      "codex": "generated"
    },
    "findings": [
      {
        "code": "HAS_SKILL_MD",
        "kind": "packaging",
        "severity": "info",
        "path": "skills/",
        "message": "Contains skill definitions"
      },
      {
        "code": "HAS_CLAUDE_PLUGIN_MANIFEST",
        "kind": "packaging",
        "severity": "info",
        "path": ".claude-plugin/plugin.json",
        "message": "Has Claude plugin manifest (convention)"
      }
    ],
    "adaptation_hints": []
  },
  "generation": {
    "claude": {
      "enabled": true,
      "mode": "native"
    },
    "codex": {
      "enabled": true,
      "mode": "generated",
      "marketplace": {
        "policy": {
          "installation": "AVAILABLE",
          "authentication": "ON_INSTALL"
        },
        "category": "Developer Tools"
      }
    }
  },
  "verification": {
    "reviewed": true,
    "skills": {
      "grill-me": true
    }
  }
}
