{
  "name": "insecure-defaults",
  "version": "1.0.0",
  "description": "Detects insecure default configurations including hardcoded credentials, fallback secrets, weak authentication defaults, and dangerous values in production",
  "authors": [
    {
      "name": "Trail of Bits",
      "email": "opensource@trailofbits.com",
      "url": "https://github.com/trailofbits"
    }
  ],
  "upstream": {
    "repo": "https://github.com/trailofbits/skills.git",
    "path": "plugins/insecure-defaults",
    "ref": "main",
    "type": "plugin",
    "last_synced_commit": "635e186d1dd9b4ec6ab41b4ba581c03194fe1eba",
    "last_checked": "2026-03-31T23:58:40.718568+00:00"
  },
  "source_model": "upstream-mirror",
  "canonical_harness": "claude",
  "package_type": "skill-wrapper",
  "files": {
    "has_skill": true,
    "has_plugin_manifest": true,
    "has_hooks": false,
    "has_commands": false,
    "has_agents": false,
    "has_templates": false
  },
  "risk": {
    "has_executable_code": false,
    "dependency_files": [],
    "tool_risk": {
      "declared_tools": [
        "Bash",
        "Glob",
        "Grep",
        "Read"
      ],
      "risk_level": "medium",
      "reasons": [
        "Bash: shell execution or file mutation"
      ]
    }
  },
  "compatibility": {
    "assessment_version": "2026-04-03.1",
    "portability_class": "adaptable",
    "supported_harnesses": [
      "claude",
      "codex",
      "copilot"
    ],
    "support_basis": {
      "claude": "native",
      "codex": "generated",
      "copilot": "generated"
    },
    "status_by_harness": {
      "claude": "native",
      "codex": "generated",
      "copilot": "generated"
    },
    "findings": [
      {
        "code": "HAS_SKILL_MD",
        "kind": "packaging",
        "severity": "info",
        "path": "skills/",
        "message": "Contains skill definitions"
      },
      {
        "code": "HAS_CLAUDE_PLUGIN_MANIFEST",
        "kind": "packaging",
        "severity": "info",
        "path": ".claude-plugin/plugin.json",
        "message": "Has Claude plugin manifest (convention)"
      },
      {
        "code": "CLAUDE_TOOL_NAME",
        "kind": "harness",
        "severity": "info",
        "path": "(multiple)",
        "message": "References Claude tool names: Bash, Glob, Grep, Read"
      }
    ],
    "adaptation_hints": [
      "Map Claude tool names to neutral capabilities"
    ]
  },
  "generation": {
    "claude": {
      "enabled": true,
      "mode": "native"
    },
    "codex": {
      "enabled": true,
      "mode": "generated",
      "marketplace": {
        "policy": {
          "installation": "AVAILABLE",
          "authentication": "ON_INSTALL"
        },
        "category": "Developer Tools"
      }
    },
    "copilot": {
      "enabled": true,
      "mode": "generated",
      "install": {
        "target_dir": ".github/skills"
      }
    }
  },
  "verification": {
    "reviewed": false,
    "skills": {
      "insecure-defaults": false
    }
  }
}
